Tipo de Anotación,Propósito Principal,Modelos Populares,Formato de Exportación Común,Estructura del Exportable (Ejemplo)
1. Clasificación (Imagen Completa),"Asignar 1 etiqueta a toda la imagen. (Ej. ""gato"", ""perro"").","ResNet, VGG, EfficientNet, MobileNet.",Estructura de Carpetas o CSV / JSON simple.,"Carpetas: dataset/gato/img1.jpg, dataset/perro/img2.jpg.CSV: imagen.jpg,gato"
2. Clasificación (Multi-Etiqueta),"Asignar MÚLTIPLES etiquetas a 1 imagen. (Ej. ""parque"", ""perro"", ""cielo_azul"").","Mismos que Clasificación (ResNet, etc.) pero con capa final y función de pérdida distintas (ej. Sigmoid + BCE).",CSV / JSON.,"JSON: {""img1.jpg"": [""parque"", ""perro""]}CSV: img1.jpg,""parque,perro"""
3. Detección de Objetos (Bounding Box),Localizar objetos usando cajas rectangulares.,"YOLO (v5, v8, etc.), SSD, Faster R-CNN, RetinaNet.","PASCAL VOC (XML), COCO (JSON), YOLO (TXT).","VOC (XML): <bndbox><xmin>...</xmin><ymin>...</ymin>... por objeto.COCO (JSON): {""bbox"": [x, y, w, h], ""category_id"": ...} por objeto.YOLO (TXT): <clase> <x_centro> <y_centro> <ancho> <alto> (normalizado)."
4. Segmentación Semántica,"Clasificar CADA PÍXEL de la imagen. (Ej. todos los píxeles de ""coche"", ""carretera"", ""cielo"").","U-Net, DeepLab, FCN.",Máscara de Imagen (PNG).,"Un archivo de imagen (ej. mascara.png) del mismo tamaño que la original. El valor del píxel (o color) indica la clase. Ej. Pixel(10,20) = 1 (Clase 1: Carretera), Pixel(50,60) = 2 (Clase 2: Coche)."
5. Segmentación de Instancia,"Localizar y delinear cada OBJETO INDIVIDUAL a nivel de píxel. (Ej. ""coche 1"", ""coche 2"").","Mask R-CNN, YOLACT, SOLOv2, (YOLOv8-seg).",COCO (JSON).,"JSON: Similar a Detección, pero en lugar de bbox (o además), incluye segmentation.{""segmentation"": [[x1,y1,x2,y2,x3,y3...]]} (un polígono) o RLE (Run-Length Encoding) de la máscara."
6. Detección de Puntos Clave (Keypoints),"Detectar puntos específicos de un objeto. (Ej. articulaciones, ojos, nariz).","OpenPose, HRNet, (Modelos como Mask R-CNN con un cabezal de keypoints).",COCO (JSON).,"JSON: La anotación incluye un array keypoints.{""keypoints"": [x1,y1,v1, x2,y2,v2, ...]} donde v es la visibilidad (ej. 0=no, 1=oculto, 2=visible)."
7. Cajas Rotadas (Oriented Bounding Box),"Detección de objetos que no están alineados con los ejes (textos, barcos, objetos en satélite).",Modelos especializados de Detección (ej. Rotated-YOLO).,XML/JSON/TXT (Personalizado).,TXT: <clase> <x_c> <y_c> <ancho> <alto> <angulo>